{
  "trial_id": "trial",
  "created_at": "2026-10-21T09:13:08+00:00",
  "updated_at": "2026-10-21T09:13:37+00:00",
  "artifacts": [
    {
      "key": "prediction_contract",
      "path": "prediction_contract.json",
      "source_skill": "prediction-contract",
      "saved_at": "2026-10-21T09:13:09+00:00",
      "version": 1
    },
    {
      "key": "dataset_profile",
      "path": "dataset_profile.json",
      "source_skill": "data-profiling",
      "saved_at": "2026-10-21T09:13:12+00:00",
      "version": 1
    },
    {
      "key": "column_profile",
      "path": "column_profile.json",
      "source_skill": "data-profiling",
      "saved_at": "2026-10-21T09:13:12+00:00",
      "version": 1
    },
    {
      "key": "workflow_plan",
      "path": "state/workflow_plan.json",
      "source_skill": "workflow-planning",
      "saved_at": "2026-10-21T09:13:12+00:00",
      "version": 1
    },
    {
      "key": "preprocessing_summary",
      "path": "outputs/pipeline/preprocessing_summary.json",
      "source_skill": "data-preprocessing",
      "saved_at": "2026-10-21T09:13:15+00:00",
      "version": 1
    },
    {
      "key": "training_summary",
      "path": "outputs/model/training_summary.json",
      "source_skill": "training",
      "saved_at": "2026-10-21T09:13:32+00:00",
      "version": 1
    },
    {
      "key": "evaluation_summary",
      "path": "outputs/report/evaluation_summary.json",
      "source_skill": "evaluation",
      "saved_at": "2026-10-21T09:13:37+00:00",
      "version": 1
    }
  ],
  "gates": {
    "prediction_contract_approved": true,
    "dataset_profile_complete": true,
    "column_profile_complete": true,
    "workflow_plan_approved": true,
    "preprocessing_complete": true,
    "training_complete": true,
    "onnx_deployment_complete": false,
    "auto_research_complete": false,
    "evaluation_complete": true,
    "explainability_complete": false,
    "model_development_documentation_complete": false
  },
  "sessions": [],
  "validation_log": [
    {
      "at": "2026-10-21T09:13:09+00:00",
      "action": "begin-skill",
      "ok": true,
      "key": null,
      "skill": "prediction-contract"
    },
    {
      "at": "2026-10-21T09:13:09+00:00",
      "action": "save-artifact",
      "ok": true,
      "key": "prediction_contract",
      "skill": "prediction-contract"
    },
    {
      "at": "2026-10-21T09:13:09+00:00",
      "action": "begin-skill",
      "ok": true,
      "key": null,
      "skill": "data-profiling"
    },
    {
      "at": "2026-10-21T09:13:12+00:00",
      "action": "save-artifact",
      "ok": true,
      "key": "dataset_profile",
      "skill": "data-profiling"
    },
    {
      "at": "2026-10-21T09:13:12+00:00",
      "action": "save-artifact",
      "ok": true,
      "key": "column_profile",
      "skill": "data-profiling"
    },
    {
      "at": "2026-10-21T09:13:12+00:00",
      "action": "begin-skill",
      "ok": true,
      "key": null,
      "skill": "workflow-planning"
    },
    {
      "at": "2026-10-21T09:13:12+00:00",
      "action": "save-artifact",
      "ok": true,
      "key": "workflow_plan",
      "skill": "workflow-planning"
    },
    {
      "at": "2026-10-21T09:13:12+00:00",
      "action": "begin-skill",
      "ok": true,
      "key": null,
      "skill": "data-preprocessing"
    },
    {
      "at": "2026-10-21T09:13:15+00:00",
      "action": "save-artifact",
      "ok": true,
      "key": "preprocessing_summary",
      "skill": "data-preprocessing"
    },
    {
      "at": "2026-10-21T09:13:15+00:00",
      "action": "begin-skill",
      "ok": true,
      "key": null,
      "skill": "training"
    },
    {
      "at": "2026-10-21T09:13:32+00:00",
      "action": "save-artifact",
      "ok": true,
      "key": "training_summary",
      "skill": "training"
    },
    {
      "at": "2026-10-21T09:13:32+00:00",
      "action": "begin-skill",
      "ok": true,
      "key": null,
      "skill": "evaluation"
    },
    {
      "at": "2026-10-21T09:13:37+00:00",
      "action": "save-artifact",
      "ok": true,
      "key": "evaluation_summary",
      "skill": "evaluation"
    }
  ],
  "goal": "Rank card transactions so analysts review the riskiest 1% first.",
  "dataset_path": "{{REPO_ROOT}}/benchmarks/evals/fixtures/datasets/synthetic_fraud.csv",
  "pending_slug": null,
  "forked_from": null,
  "package_version": "0.1.0",
  "last_claude_session_id": null,
  "previous_trial_dirs": [],
  "active_skill": "evaluation",
  "developer_focus": []
}
